{
  "$schema": "https://json-schema.org/draft/2020-12/schema",
  "title": "Pasol Pattern Report 1.0.0",
  "type": "object",
  "additionalProperties": false,
  "required": ["schema_version", "engine", "pattern_pack", "input", "status", "matches", "warnings", "limits", "timing"],
  "properties": {
    "schema_version": {"const": "1.0.0"},
    "engine": {"$ref": "#/$defs/engine"},
    "pattern_pack": {"$ref": "#/$defs/pack"},
    "input": {"$ref": "#/$defs/input"},
    "status": {"enum": ["completed", "timeout", "resource_limited", "worker_failed", "invalid_input", "invalid_pack", "unsupported_engine", "not_evaluated"]},
    "matches": {"type": "array", "maxItems": 1024, "items": {"$ref": "#/$defs/match"}},
    "warnings": {"type": "array", "maxItems": 256, "items": {"$ref": "#/$defs/warning"}},
    "limits": {"type": "object", "additionalProperties": false, "required": ["input_bytes", "report_bytes", "matching_rules", "evidence_entries", "matches_per_pattern", "compiler_warnings", "locations_per_rule"], "properties": {"input_bytes": {"type": "integer", "minimum": 1}, "report_bytes": {"type": "integer", "minimum": 1}, "matching_rules": {"type": "integer", "minimum": 1}, "evidence_entries": {"type": "integer", "minimum": 1}, "matches_per_pattern": {"type": "integer", "minimum": 1}, "compiler_warnings": {"type": "integer", "minimum": 1}, "locations_per_rule": {"type": "integer", "minimum": 1}}},
    "timing": {"type": "object", "additionalProperties": false, "required": ["compile_time_ms", "scan_time_ms"], "properties": {"compile_time_ms": {"type": "integer", "minimum": 0}, "scan_time_ms": {"type": "integer", "minimum": 0}}}
  },
  "$defs": {
    "engine": {"type": "object", "additionalProperties": false, "required": ["id", "version"], "properties": {"id": {"type": "string", "minLength": 1, "maxLength": 4096}, "version": {"type": "string", "minLength": 1, "maxLength": 4096}}},
    "pack": {"type": "object", "additionalProperties": false, "required": ["id", "version", "sha256", "signature_state"], "properties": {"id": {"type": "string", "minLength": 1, "maxLength": 4096}, "version": {"type": "string", "minLength": 1, "maxLength": 4096}, "sha256": {"type": "string", "pattern": "^[0-9a-f]{64}$"}, "signature_state": {"enum": ["verified", "development"]}}},
    "input": {"type": "object", "additionalProperties": false, "required": ["sha256", "size_bytes"], "properties": {"sha256": {"type": "string", "pattern": "^[0-9a-f]{64}$"}, "size_bytes": {"type": "integer", "minimum": 0}, "file_type": {"type": "string", "maxLength": 4096}}},
    "metadata": {"type": ["string", "integer", "boolean"]},
    "match": {"type": "object", "additionalProperties": false, "required": ["namespace", "rule", "tags", "metadata", "locations", "evidence_truncated"], "properties": {"namespace": {"type": "string", "minLength": 1, "maxLength": 4096}, "rule": {"type": "string", "minLength": 1, "maxLength": 4096}, "tags": {"type": "array", "maxItems": 64, "items": {"type": "string", "maxLength": 4096}}, "metadata": {"type": "object", "maxProperties": 64, "additionalProperties": {"$ref": "#/$defs/metadata"}}, "locations": {"type": "array", "maxItems": 256, "items": {"type": "object", "additionalProperties": false, "required": ["offset", "length", "identifier"], "properties": {"offset": {"type": "integer", "minimum": 0}, "length": {"type": "integer", "minimum": 0}, "identifier": {"type": "string", "minLength": 1, "maxLength": 4096}, "xor_key": {"type": "integer", "minimum": 0, "maximum": 255}}}}, "evidence_truncated": {"type": "boolean"}}},
    "warning": {"type": "object", "additionalProperties": false, "required": ["code", "message"], "properties": {"code": {"type": "string", "minLength": 1, "maxLength": 4096}, "message": {"type": "string", "minLength": 1, "maxLength": 4096}}}
  }
}
