{
  "schema_version": "1.0.0",
  "engine": {
    "id": "yara-x",
    "version": "1.19.0"
  },
  "pattern_pack": {
    "id": "pasol.test",
    "version": "0.1.0",
    "sha256": "aaaaaaaaaaaaaaaaaaaaaaaaaaaaaaaaaaaaaaaaaaaaaaaaaaaaaaaaaaaaaaaa",
    "signature_state": "development"
  },
  "input": {
    "sha256": "bbbbbbbbbbbbbbbbbbbbbbbbbbbbbbbbbbbbbbbbbbbbbbbbbbbbbbbbbbbbbbbb",
    "size_bytes": 5
  },
  "status": "completed",
  "matches": [
    {
      "namespace": "pasol",
      "rule": "marker",
      "tags": [
        "test"
      ],
      "metadata": {
        "category": "synthetic"
      },
      "locations": [
        {
          "offset": 0,
          "length": 5,
          "identifier": "$marker"
        }
      ],
      "evidence_truncated": false
    }
  ],
  "warnings": [],
  "limits": {
    "input_bytes": 33554432,
    "report_bytes": 1048576,
    "matching_rules": 128,
    "evidence_entries": 1024,
    "matches_per_pattern": 32,
    "compiler_warnings": 64,
    "locations_per_rule": 32
  },
  "timing": {
    "compile_time_ms": 0,
    "scan_time_ms": 0
  }
}
